{
  "version": "1",
  "command_id": "cmd-hola-mundo-0003",
  "tenant": "eduardo-research",
  "action": "insight.create",
  "requested_by": "chatgpt",
  "payload": {
    "title": "Hola mundo",
    "language": "es",
    "status": "draft",
    "content": "Hola mundo. Esta es la primera entrada creada y gestionada mediante Research Manager MCP."
  }
}
